"conversation_id_str","created_at","favorite_count","full_text","id_str","image_url","in_reply_to_screen_name","lang","location","quote_count","reply_count","retweet_count","tweet_url","user_id_str","username"
"1772792355990695972","Wed Mar 27 01:06:49 +0000 2024","95"," Pemprov DKI Jakarta anggarkan 6 3 M pembelian MoGe Listrik untuk kawal Gubenur Apanya yg mo dikawal? Lha wong Heru Budi itu kerjanya cuma tidur doang banjir dimana² cuma minta maaf dan rakyat suruh maklumi! Jokowi dan orang²nya ini tiap hari kerjanya ngajak perang mollo! https://t.co/NjXpcGYbWr","1772792355990695972","https://pbs.twimg.com/ext_tw_video_thumb/1772791658536697856/pu/img/6J-LcKhp2bAyyNVa.jpg","","in","🦉🤍","2","10","51","https://twitter.com/AnKiiim_/status/1772792355990695972","1603276472814567425","AnKiiim_"
"1772222628402487774","Mon Mar 25 11:22:55 +0000 2024","545","Jakarta kalau hujan lebih dari 4 jam lebih kita kewalahan mohon maaf dan harap dimaklumi ~ Heru Budi https://t.co/6uChFWt3sX","1772222628402487774","https://pbs.twimg.com/ext_tw_video_thumb/1772222564674555904/pu/img/MZNoQiVAYqZj4LOQ.jpg","","in","Jakarta Capital Region","34","225","196","https://twitter.com/Mdy_Asmara1701/status/1772222628402487774","1334853481019056128","Mdy_Asmara1701"
"1773646179294699758","Fri Mar 29 09:39:36 +0000 2024","1824","Udah bener kayak DKI Jakarta mau nikah wajib tes kesehatan dan kejiwaan (kedua calon) ️ diberikan sertifikat layak kawin. Tes kesehatan umum termasuk tes darah untuk PMS Asesmen kejiwaan dasar Vaksin TT untuk perempuan KTP Jakarta gratis lainnya bayar. https://t.co/UGMQJmIDE3","1773646179294699758","https://pbs.twimg.com/media/GJ1ByyPaoAAHb2P.jpg","","in","Indonesia","75","43","523","https://twitter.com/mcitraningrum/status/1773646179294699758","69806285","mcitraningrum"
"1774435417007538549","Sun Mar 31 14:14:30 +0000 2024","54","@psi_id dua kasus yang tidak mau ditanggapi PSI 1. Pelecehan kadernya di Jakarta Barat 2. Korupsi Timah","1774440136060829905","","psi_id","in","Padang, Minangkabau","0","4","6","https://twitter.com/ajiiiikk/status/1774440136060829905","516483504","ajiiiikk"
"1773252136379236847","Thu Mar 28 07:33:49 +0000 2024","866","ty track in jakarta semoga promotor yg bawa lebih proper dan jauh lebih baik ","1773252136379236847","","","in","somewhere only we know","51","40","336","https://twitter.com/cestlavieunoia/status/1773252136379236847","394499332","cestlavieunoia"
"1773170024380829901","Thu Mar 28 02:07:32 +0000 2024","5712","LRT Jabodebek bukan programnya @aniesbaswedan tapi judul dan fotonya pake foto Pak Anies. Beritanya tanggal 27 maret 2024. . Media aja mau nyari klik tapi caranya dengan nyalahin anies baswedan. Kesian bener pak. https://t.co/aLTyLg0QKs","1773170024380829901","","","in","New York, NY","74","142","1174","https://twitter.com/AnggaPutraF/status/1773170024380829901","98275340","AnggaPutraF"
"1773617927507284182","Fri Mar 29 07:47:20 +0000 2024","64"," jakarta Barat Whatsaap : 082248297727 Line : neiisiaa https://t.co/vHO9JIL8GK","1773617927507284182","https://pbs.twimg.com/ext_tw_video_thumb/1773617889381433344/pu/img/7TDkMiJDwBywGgDk.jpg","","in","DKI Jakarta, Indonesia","0","6","7","https://twitter.com/TransXia/status/1773617927507284182","1464158397377433600","TransXia"
"1772868538199597297","Wed Mar 27 06:09:32 +0000 2024","191","˚ʚɞ˚ help rt &amp; like ˚ʚɞ˚ TREASURE RELAY TOUR REBOOT IN JAKARTA Freebies by @jyhonie day 2 indonesia Arena GBK Senayan https://t.co/0cmqRxwUi9","1772868538199597297","https://pbs.twimg.com/media/GJp-iW1bAAAt1Y-.jpg","","in","Depok, Indonesia","3","11","174","https://twitter.com/jyhonie/status/1772868538199597297","1469694116992729090","jyhonie"
"1774488289627799967","Sun Mar 31 17:25:51 +0000 2024","27","Dosen Universitas Negeri Jakarta Ubedilah Badrun dan guru besar hukum Universitas Indonesia (UI) Sulistyowati Irianto mewakili 303 guru besar akademisi dan kalangan masyarakat sipil mengirimkan surat amicus curiae terkait sengketa Pilpres 2024 ke MK. https://t.co/bSsdjaknt9","1774488289627799967","","","in","Bandung, Jawa Barat","1","0","4","https://twitter.com/devy_casanofa/status/1774488289627799967","1576577082909691904","devy_casanofa"
"1772975160175259940","Wed Mar 27 13:13:13 +0000 2024","2658","minwon three tweets au caper ke pacar dengan cara centil from Hujan Jakarta dan Kita series https://t.co/8PCsd1CFe6","1772975160175259940","https://pbs.twimg.com/media/GJrfgH_bQAAb2lr.jpg","","in","RPS","9","3","355","https://twitter.com/eijullies/status/1772975160175259940","1539084539527454720","eijullies"
"1773660266401595641","Fri Mar 29 10:35:35 +0000 2024","282","FANCON RIIZE DI JAKARTA OT7 AAMIINNNN!!!","1773660266401595641","","","in","Copi.","15","3","94","https://twitter.com/wonbinsites/status/1773660266401595641","2487238801","wonbinsites"
"1773271334241309051","Thu Mar 28 08:50:06 +0000 2024","750","PSI to nominate Jokowi's son for Jakarta governor - Jakarta - The Jakarta Post #jakpost https://t.co/Y7JyIG9DRx https://t.co/V4wcNBuScK","1773271334241309051","https://pbs.twimg.com/media/GJvs4ZuWEAAU8xN.jpg","","in","Jakarta","3136","538","252","https://twitter.com/jakpost/status/1773271334241309051","68577507","jakpost"
"1773359239957758133","Thu Mar 28 14:39:24 +0000 2024","155","Nambah flyover atau JLNT ga bakalan bikin Jakarta lancar men. https://t.co/RaW9oRRans","1773359239957758133","https://pbs.twimg.com/media/GJw80pWWcAAwJet.jpg","","in","","1","2","62","https://twitter.com/id_curiocity/status/1773359239957758133","1484516879201075208","id_curiocity"
"1774330829570994664","Sun Mar 31 07:00:09 +0000 2024","59","Tinggal beberapa hari lagi mudik.. yang mau isi slot JAKARTA bisa di isi untuk sekarang.. #pijatsensual #massagevitalitas #availJakarta #massagepriajakarta #escortjakarta https://t.co/U12K5U2Nyq","1774330829570994664","https://pbs.twimg.com/ext_tw_video_thumb/1774330619226681344/pu/img/DqAKd6OvcrL9AzLI.jpg","","in","Jakarta Capital Region","0","1","11","https://twitter.com/lintangyusuf35/status/1774330829570994664","1697176758523723776","lintangyusuf35"
"1774130319555506431","Sat Mar 30 17:43:24 +0000 2024","633","Tiket Sleman Terjual Habis Surakarta Sold Out Away Jakarta Surabaya Tiket dibuka . Operator Memberhentikan Liga Seenaknya ","1774130319555506431","","","in","Kabupaten Magelang","10","12","226","https://twitter.com/Dhicry_27/status/1774130319555506431","979908115","Dhicry_27"
"1773596128086208998","Fri Mar 29 06:20:43 +0000 2024","1","[HELP RT - WTS] Yang udah punya THR monggo bisa langsung co phantasy part 3 sealed album nya. READY INA bisa kirim senin/selasa sama 4.4 yaaa terakhir sebelum lebaran dom Jakarta Selatan. https://t.co/zfFlTTdeeT tag : wts lfb theboyz phantasy part 3 sealed album","1773596128086208998","","","in","","0","0","21","https://twitter.com/hellodeobi/status/1773596128086208998","1277209995990364165","hellodeobi"
"1773286026426900585","Thu Mar 28 09:48:29 +0000 2024","231","𝓯𝓻𝓮𝓮𝓫𝓲𝓮𝓼 pocket mirror ngaca mulu?! udah cantik!! FOR TREASURE RELAY TOUR REBOOT IN JAKARTA DAY-2 ‼️ by @/wolfasyaa | @PJW_B00 How to get? Just say 'Hi Asya!' and you'll get it! ️ 30 Juni 2024 INDONESIA ARENA GBK SENAYAN limited quantity. see you teume https://t.co/tAOmzcTHZS","1773286026426900585","https://pbs.twimg.com/media/GJv6PY-aUAAzo_B.jpg","","in","🇮🇩","7","25","185","https://twitter.com/PJW_B00/status/1773286026426900585","1500542016995803138","PJW_B00"
"1773262461241643498","Thu Mar 28 08:14:51 +0000 2024","920","MENIFESTING DJJ FANCON JAKARTA DPT PROMOTOR YG BENER","1773262461241643498","","","in","jungp/johfam","72","26","358","https://twitter.com/sugaringcandyyz/status/1773262461241643498","1704289885560188928","sugaringcandyyz"
"1773358967512588307","Thu Mar 28 14:38:19 +0000 2024","226","Hai teman mutualku! please bantu RT / share ya thank u Open PO Keychain Treasure Bisa custom boygrup lain ya!! Keychain Cutie-Cam ver. Keychain: 22k/each Bisa DP &amp; pelunasan by shopee Jakarta Close 10 April 2024 https://t.co/X94fYTT2Ud","1773358967512588307","https://pbs.twimg.com/media/GJw8lIZWgAAVhQT.jpg","","in","","7","11","231","https://twitter.com/venusshereee/status/1773358967512588307","1646586299447648257","venusshereee"
"1773397002682073124","Thu Mar 28 17:09:28 +0000 2024","71","#REVIEWPENGEMBARA 13. Menyala di Jakarta: Ari ️‍| Rating: ⭐️⭐️⭐️⭐️ https://t.co/qZ2SeHdCKJ","1773397002682073124","https://pbs.twimg.com/media/GJxfJAjakAAUb10.jpg","","in","Jakarta Capital Region","2","4","9","https://twitter.com/namanyahandaru/status/1773397002682073124","1710908094740627456","namanyahandaru"
"1774329544062931072","Sun Mar 31 06:55:03 +0000 2024","14","Available area jakarta In out jakarta luar jakarta Call me 085316617988 #pijatjakarta #pijatsurabaya #pijatbandung #pijatsemarang Area JAKARTA https://t.co/ORESfw96v0","1774329544062931072","https://pbs.twimg.com/media/GJ-vUUca0AADGUw.jpg","","in","","0","0","14","https://twitter.com/TaraTa60452/status/1774329544062931072","1746838748799946752","TaraTa60452"
"1772956766302880116","Wed Mar 27 12:00:07 +0000 2024","5596","[PENGUMUMAN TERUPDATE SEATING MAP] Silahkan cek seating map terupdate kami dan jangan sampai ketinggalan untuk membeli tiket kamu tanggal 02 April nanti! 2024 BAEKHYUN ASIA TOUR [Lonsdaleite] IN JAKARTA 01 JUNI 2024 (SAB) 7PM (WIB) 02 JUNI 2024 (MIN) 7PM (WIB) ICE https://t.co/5SPY8qmoU2","1772956766302880116","https://pbs.twimg.com/media/GJrNqD4boAA8QFp.jpg","","in","","1690","451","2829","https://twitter.com/applewood_kr/status/1772956766302880116","968690272279252992","applewood_kr"
"1773686510363070860","Fri Mar 29 12:19:52 +0000 2024","98","Presiden @jokowi menggelar buka puasa bersama Menteri Kabinet Indonesia Maju di Istana Negara Jakarta Kamis (28/03/2024). Simak liputannya di #LensaKabinet berikut ini yuk! https://t.co/6d86TqhwSz","1773686510363070860","https://pbs.twimg.com/amplify_video_thumb/1773686425600602112/img/O_VdJ9h0lP1TtZNm.jpg","","in","Jakarta","2","20","12","https://twitter.com/setkabgoid/status/1773686510363070860","260686783","setkabgoid"
"1772217847969685514","Mon Mar 25 11:03:55 +0000 2024","15","Js Kebugaran _______BJ_______ _____B__2__B____ Crot bareng Vcs____________________️️️️ Jakarta https://t.co/vgjQF06vYx","1772217847969685514","https://pbs.twimg.com/media/GJguvPlboAAMsj1.jpg","","in","Jakarta Selatan, DKI Jakarta","0","0","20","https://twitter.com/aloifg148/status/1772217847969685514","1696607742054805504","aloifg148"
"1772985223191376210","Wed Mar 27 13:53:12 +0000 2024","42","Dia semanis madu dia seindah senja dia setenang malam dan kini dia membuat duniaku penuh luka karena kenangan . Senja kali ini d kota jakarta.. https://t.co/jQrGIQbFZ7","1772985223191376210","https://pbs.twimg.com/ext_tw_video_thumb/1772985180824944640/pu/img/J8dPsQ2AsDA5dlZ-.jpg","","in","","0","4","3","https://twitter.com/Embunwardana/status/1772985223191376210","1312780175361273859","Embunwardana"
"1773170483581555199","Thu Mar 28 02:09:21 +0000 2024","3044","Kaesang Belum Cukup Umur Jadi Cagub DKI Jakarta Akankah Aturannya Diubah? https://t.co/G20LsTt0VJ","1773170483581555199","","","in","Indonesia","242","514","748","https://twitter.com/geloraco/status/1773170483581555199","3319260420","geloraco"
"1772425672314454486","Tue Mar 26 00:49:45 +0000 2024","8","*OPEN ORDER MAGAZINE CHANYEOL FOR OK* By @go_yeolkyung Paket A Rp121.220 paket B :* Rp 121.220 DP 100.000 paket C: Rp 227.440 DP 100.000 bersih ch include shipping close 20 April Tax Go Jakarta Utara https://t.co/JablkicYZh","1772425672314454486","https://pbs.twimg.com/media/GJjrwRxaEAARup2.jpg","","in","","2","2","28","https://twitter.com/rifdamariaulfa/status/1772425672314454486","2716601666","rifdamariaulfa"
"1774356637421285705","Sun Mar 31 08:42:42 +0000 2024","3843","tahun ini udah jadi belum buka puasa &amp; taraweh di Istiqlal? https://t.co/nt5FP5vLqm","1774356637421285705","https://pbs.twimg.com/media/GJ_H9A9bkAE_V5M.jpg","","in","","317","541","267","https://twitter.com/txtdrjkt/status/1774356637421285705","1252667805947723776","txtdrjkt"
"1772867303157436594","Wed Mar 27 06:04:38 +0000 2024","3267","Polisi mengamankan MI (18) Supir truk yang menjadi penyebab kecelakaan beruntun di Gerbang Tol Halim Utama Jakarta Timur. (Sopir truk) gak punya SIM Waaah niatnya emang mau kabur pantes ugal ugalan mana bawa muatannya serem banget https://t.co/7SzDBj4syu","1772867303157436594","https://pbs.twimg.com/ext_tw_video_thumb/1772867205061124096/pu/img/L6tNbKdHJ4U0ZgPK.jpg","","in","","393","221","1005","https://twitter.com/BolaBolaAja/status/1772867303157436594","1517456288154013698","BolaBolaAja"
"1773774021722849749","Fri Mar 29 18:07:36 +0000 2024","40","Veby Sudah Ready Jakarta Lagi Yaaa https://t.co/q3IcVuC1u9","1773774021722849749","https://pbs.twimg.com/ext_tw_video_thumb/1773773965598793729/pu/img/qBxnIOioRK232OaY.jpg","","in","Jakarta Capital Region","0","1","7","https://twitter.com/queenveby26/status/1773774021722849749","1744077303142096896","queenveby26"
"1772953772148260998","Wed Mar 27 11:48:13 +0000 2024","49","Jakarta keras bos Motor mau motong jalan naik ke trotoar aje harus bayar sama Akamsi TKP : Jembatan setelah DPR ke arah Palmerah https://t.co/6pSe6lDw7D","1772953772148260998","https://pbs.twimg.com/ext_tw_video_thumb/1772953601616551936/pu/img/lT1-6aykPqq93BOx.jpg","","in","Mampang Prapatan ","5","10","23","https://twitter.com/KepaArgawinata7/status/1772953772148260998","1712328551515709440","KepaArgawinata7"
"1772961394771513544","Wed Mar 27 12:18:31 +0000 2024","2800","Inilah kenapa transportasi umum massal di kota se-berdenyut Jakarta itu harus 24 jam. Jakarta udah ga jauh beda dgn NYC the city that NEVER sleeps. Transjabodetabek Damri sama Royaltrans potensial dibikin 24/7 loh asal ada niat dr pemerintah aja. Dibikin 24/7 pasti laku.","1772961394771513544","","","in","Tangerang","84","32","1232","https://twitter.com/jr205newlivery/status/1772961394771513544","1051654604008480768","jr205newlivery"
"1774142185384133001","Sat Mar 30 18:30:33 +0000 2024","140","Yasss UU DKJ udah sah! Gubernur dan wakil gubernur Jakarta masih bisa dipilih langsung sama kita! #TegakkanHukum #KPKRI #UndangUndang https://t.co/yyn6tN66Y6","1774142185384133001","https://pbs.twimg.com/ext_tw_video_thumb/1774141905351426048/pu/img/WYuJZTOkX0TFpJbr.jpg","","in","Bandung","0","99","32","https://twitter.com/OposisiLieur/status/1774142185384133001","113533520","OposisiLieur"
"1774596527010504784","Mon Apr 01 00:35:57 +0000 2024","17","Hari terakhir...... kangen indonesia Tomorrow #jakarta ️️️ https://t.co/xE2b7koyBg","1774596527010504784","https://pbs.twimg.com/media/GKCiIv_aoAARQ29.jpg","","in","Singapore","0","0","24","https://twitter.com/CiCiLiyLiee/status/1774596527010504784","1764576283932164096","CiCiLiyLiee"
"1773267996091302164","Thu Mar 28 08:36:50 +0000 2024","1","-rl kalian lahir di jakarta bukan?","1773267996091302164","","","in","DKI Jakarta, Indonesia","62","298","0","https://twitter.com/ssefnum/status/1773267996091302164","1331620633726259200","ssefnum"
"1773235377731453339","Thu Mar 28 06:27:13 +0000 2024","13","Pakistan girl from jakarta https://t.co/bSmYyV4dQ9","1773235377731453339","https://pbs.twimg.com/media/GJvMLWNbwAAjdXb.jpg","","in","","0","0","4","https://twitter.com/BoneJamess71925/status/1773235377731453339","1725886492651008000","BoneJamess71925"
"1772607184741744859","Tue Mar 26 12:51:00 +0000 2024","30","Massge in/Outcall Vcs Jakarta dan luar kota. #pijatpanggilan #pijatjakarta #pijatbogor #pijatdepok #pijatpria #pijatvitalitas #massagefullbody Wa: 087772040750 https://t.co/tmk5dRVt9l","1772607184741744859","https://pbs.twimg.com/media/GJmQ1UlbsAAMluN.jpg","","in","DKI Jakarta, Indonesia","0","1","37","https://twitter.com/fahri_m559e/status/1772607184741744859","1716148694888906752","fahri_m559e"
"1774606409877094544","Mon Apr 01 01:15:13 +0000 2024","11","Selamat pagi https://t.co/y1kkVbO86O","1774606409877094544","https://pbs.twimg.com/media/GKCrHn4aUAE9HAu.jpg","","in","Amerika","0","0","14","https://twitter.com/shellen_shell98/status/1774606409877094544","1676663486951362561","shellen_shell98"
"1774478989664620949","Sun Mar 31 16:48:54 +0000 2024","70","Kaesang Belum Cukup Umur Jadi Cagub DKI Jakarta Akankah Aturannya Diubah? Mendingan Langsung Lantik Saja. Daripada Nanti Makan Bansos Lagi Bertrilyun-trilyun.. https://t.co/9MxZN2WtpF","1774478989664620949","","","in","Jakarta","2","4","31","https://twitter.com/Kanseulir/status/1774478989664620949","279312062","Kanseulir"
"1774614239094903247","Mon Apr 01 01:46:19 +0000 2024","23","Kritisi UU DKJ HNW: Berdasarkan Konstitusi UU DKJ Tak Berikan Keadilan bagi Jakarta Dibanding Daerah Khusus Lain https://t.co/tf7KqT7UYl via @FPKSDPRRI | @hn","1774614239094903247","","","in","Jakarta Capital Region","0","0","12","https://twitter.com/FPKSDPRRI/status/1774614239094903247","91255162","FPKSDPRRI"
